#Flags,Grouping,Os,Values,Default,Conforming?,Description,Prerequisites,Implies
-freschedule-modulo-scheduled-loops,,,,,,"The modulo scheduling comes before the traditional scheduling, if a loop was modulo scheduled we may want to prevent the later scheduling passes from changing its schedule, we use this option to control that. ",-fschedule-insns or -fschedule-insns2,
-fsched-critical-path-heuristic,,,,,,Enable the critical-path heuristic in the scheduler. This heuristic favors instructions on the critical path.,-fschedule-insns or -fschedule-insns2,
-fsched-dep-count-heuristic,,,,,,Enable the dependent-count heuristic in the scheduler. This heuristic favors the instruction that has more instructions depending on it. ,-fschedule-insns or -fschedule-insns2,
-fsched-group-heuristic,,,,,,Enable the group heuristic in the scheduler. This heuristic favors the instruction that belongs to a schedule group,-fschedule-insns or -fschedule-insns2,
-fsched-last-insn-heuristic,,,,,,Enable the last-instruction heuristic in the scheduler. This heuristic favors the instruction that is less dependent on the last instruction scheduled.,-fschedule-insns or -fschedule-insns2,
-fsched-pressure,,,,,,"Enable register pressure sensitive insn scheduling before the register allocation. This only makes sense when scheduling before register allocation is enabled, i.e. with -fschedule-insns or at -O2 or higher. Usage of this option can improve the generated code and decrease its size by preventing register pressure increase above the number of available hard registers and as a consequence register spills in the register allocation. ",-fschedule-insns,
-fsched-rank-heuristic,,,,,,Enable the rank heuristic in the scheduler. This heuristic favors the instruction belonging to a basic block with greater size or frequency.,-fschedule-insns or -fschedule-insns2,
-fsched-spec-insn-heuristic,,,,,,Enable the speculative instruction heuristic in the scheduler. This heuristic favors speculative instructions with greater dependency weakness. ,-fschedule-insns or -fschedule-insns2,
-fsched-spec-load,,,,,,Allow speculative motion of some load instructions.,-fschedule-insns,
-fsched-spec-load-dangerous,,,,,,Allow speculative motion of some load instructions.,-fschedule-insns,
-fsched-stalled-insns,,,0+,?,,"Define how many insns (if any) can be moved prematurely from the queue of stalled insns into the ready list, during the second scheduling pass. ",-fschedule-insns,
-fsched-stalled-insns-dep,,,0+,?,,Define how many insn groups (cycles) will be examined for a dependency on a stalled insn that is candidate for premature removal from the queue of stalled insns.,-fschedule-insns,
-fsched2-use-superblocks,,,,,,"When scheduling after register allocation, do use superblock scheduling algorithm. Superblock scheduling allows motion across basic block boundaries resulting on faster schedules. This option is experimental, as not all machine descriptions used by GCC model the CPU closely enough to avoid unreliable results from the algorithm.",-fschedule-insns2,
-fsel-sched-pipelining,,,,,,Enable software pipelining of innermost loops during selective scheduling.,-fselective-scheduling or -fselective-scheduling2,
-fsel-sched-pipelining-outer-loops,,,,,,"When pipelining loops during selective scheduling, also pipeline outer loops. ",-fsel-sched-pipelining,
-fselective-scheduling,,,,,,Schedule instructions using selective scheduling algorithm. Selective scheduling runs instead of the first scheduler pass. ,-fschedule-insns or -fschedule-insns2,
-fselective-scheduling2,,,,,,Schedule instructions using selective scheduling algorithm. Selective scheduling runs instead of the second scheduler pass. ,-fschedule-insns or -fschedule-insns2,
-fsplit-ivs-in-unroller,,,,,,"Enables expressing of values of induction variables in later iterations of the unrolled loop using the value in the first iteration. This breaks long dependency chains, thus improving efficiency of the scheduling passes.",,
-ftracer,,,,,,Perform tail duplication to enlarge superblock size. This transformation simplifies the control flow of the function allowing other optimizations to do better job. ,,
-ftree-loop-distribution,,,,,,"Perform loop distribution. This flag can improve cache performance on big loop bodies and allow further loop optimizations, like parallelization or vectorization, to take place.",,
-ftree-loop-if-convert,,,,,,Attempt to transform conditional jumps in the innermost loops to branch-less equivalents. The intent is to remove control-flow from the innermost loops in order to improve the ability of the vectorization pass to handle these loops. This is enabled by default if vectorization is enabled. ,,
-ftree-loop-if-convert-stores,,,,,N,Attempt to also if-convert conditional jumps containing memory writes. This transformation can be unsafe for multi-threaded programs as it transforms conditional memory writes into unconditional memory writes,,
-ftree-loop-im,,,,,,"Perform loop invariant motion on trees. This pass moves only invariants that would be hard to handle at RTL level (function calls, operations that expand to nontrivial sequences of insns). With -funswitch-loops it also moves operands of conditions that are invariant out of the loop, so that we can use just trivial invariantness analysis in loop unswitching. The pass also includes store motion. ",,
-ftree-loop-ivcanon,,,,,,Create a canonical counter for number of iterations in loops for which determining number of iterations requires complicated analysis. Later optimizations then may determine the number easily. Useful especially in connection with unrolling. ,,
-ftree-parallelize-loops=n,,,1+,,,"Parallelize loops, i.e., split their iteration space to run in n threads. This is only possible for loops whose iterations are independent and can be arbitrarily reordered. The optimization is only profitable on multiprocessor machines, for loops that are CPU-intensive, rather than constrained e.g. by memory bandwidth. This option implies -pthread, and thus is only supported on targets that have support for -pthread. ",pthreads,
-funroll-all-loops,,,,,,"Unroll all loops, even if their number of iterations is uncertain when the loop is entered. This usually makes programs run more slowly. -funroll-all-loops implies the same options as -funroll-loops, ",,"-frerun-cse-after-loop, -fweb, -frename-registers"
-funroll-loops,,,,,,"Unroll loops whose number of iterations can be determined at compile time or upon entry to the loop. -funroll-loops implies -frerun-cse-after-loop. This option makes code larger, and may or may not make it run faster. ",,"-frerun-cse-after-loop, -fweb, -frename-registers"
-funsafe-loop-optimizations,,,,,,"If given, the loop optimizer will assume that loop indices do not overflow, and that the loops with nontrivial exit condition are not infinite. This enables a wider range of loop optimizations even if the loop optimizer itself cannot prove that these assumptions are valid. ",,
-fvariable-expansion-in-unroller,,,,,,"With this option, the compiler will create multiple copies of some local variables when unrolling a loop which can result in superior code. ",,
-fvect-cost-model,,,,,,Enable cost model for vectorization. ,,
-fweb,,,,,,"Constructs webs as commonly used for register allocation purposes and assign each web individual pseudo register. This allows the register allocation pass to operate on pseudos directly, but also strengthens several other optimization passes, such as CSE, loop optimizer and trivial dead code remover. It can, however, make debugging impossible, since variables will no longer stay in a “home register”.",,
-fwhole-program,,,,,,Assume that the current compilation unit represents the whole program being compiled. All public functions and variables with the exception of main and those merged by attribute externally_visiblebecome static functions and in effect are optimized more aggressively by interprocedural optimizers.,,
